<?xml version="1.0" encoding="UTF-8" standalone="yes"?>
<KmsResponse Version="1.0.0" xmlns:xsi="http://www.w3.org/2001/XMLSchema-instance"
			 xmlns="http://www.kapsch.net/mcptt/xml/KmsInterface"
			 xsi:schemaLocation="http://www.kapsch.net/mcptt/xml/KmsInterface KmsInterface_XMLSchema.xsd">
	<KmsUri>kms.example.org</KmsUri>
	<UserUri>test4@example.org</UserUri>
	<Time>2018-02-21T13:31:26.988</Time>
	<KmsId>kms.example.org</KmsId>
	<ClientReqUrl>/keymanagement/identity/v1/keyprov</ClientReqUrl>
	<KmsMessage>
		<KmsKeyProv Version="1.0.0">
			<KmsKeySet Version="1.1.0">
				<KmsUri>kms.example.org</KmsUri>
				<UserUri>test4@example.org</UserUri>
				<UserID>99ECDB11D33AD5CE3D69CE578F9CC0768BE812D33E31654907CE65EABBADA63C</UserID>
				<ValidFrom>2018-02-19T00:00:00</ValidFrom>
				<ValidTo>2018-03-19T00:00:00</ValidTo>
				<KeyPeriodNo>1541</KeyPeriodNo>
				<UserDecryptKey>
					04287DBDCFED0139080914158E1428CDC0BACFFD3798AD6B3423A2D4D4866DCB77B07338EB17B34E4924E72A753D7B25F9F8B86ABCB51D577B9DD776131D9B28C829C541EE24E3DA75E88EBD56D05AB28DFB5ED1C657A1C959B6C2603AA52AF48BDAB8F3ED4D11EC8EA114871DD3809A281A3AEE7B20DCBBF6E69683292A1F9AD65B86E1F56EF0743EA16A740BF717BCEC6B6D166C7B354B0F5454EF749A633ADE182FBBC757DDEE84F04379667AD0F52A834AD24E78AC4C45C377F18735C7EB504652A07A0960575CCDD066A8169EBC4DCC3DD3E8C595CB7A44E09521ADEDF6449D06D30DF03027F8FC3DC64743EEBB291905BEC5924C8559664B6E4BB43B103F
				</UserDecryptKey>
				<UserSigningKeySSK>898BE034B494065BBE4C736F6C92721BEFB078C00C48F5519E0C60739C80EF82</UserSigningKeySSK>
				<UserPubTokenPVT>
					04E685A80E5FCA4FF971EF5D0CF91E05AB94196966A0546B04E64814E4C6B16C33B49BB600D044ADCD241146C0F2A19200D483071C9F8E1491EE8515513396DF93
				</UserPubTokenPVT>
			</KmsKeySet>
		</KmsKeyProv>
	</KmsMessage>
</KmsResponse>
