<?xml version="1.0" encoding="UTF-8" standalone="yes"?>
<KmsResponse Version="1.0.0" xsi:schemaLocation="http://www.kapsch.net/mcptt/xml/KmsInterface KmsInterface_XMLSchema.xsd" xmlns="http://www.kapsch.net/mcptt/xml/KmsInterface" xmlns:ds="http://www.w3.org/2000/09/xmldsig#" xmlns:xsi="http://www.w3.org/2001/XMLSchema-instance">
	<KmsUri>kms.example.org</KmsUri>
	<UserUri>user@example.org</UserUri>
	<Time>2014-01-26T10:07:14</Time>
	<KmsId>KMSProvider12345</KmsId>
	<ClientReqUrl>http://kms.example.org/keymanagement/identity/v1/keyprov</ClientReqUrl>
	<KmsMessage>
		<KmsKeyProv Version="1.0.0">
			<KmsKeySet Version="1.1.0">
				<KmsUri>kms.example.org</KmsUri>
				<CertUri>cert1.kms.example.org</CertUri>
				<Issuer>www.example.org</Issuer>
				<UserUri>user@example.org</UserUri>
				<UserID>0123456789ABCDEF0123456789ABCDEF</UserID>
				<ValidFrom>2015-12-30T00:00:00</ValidFrom>
				<ValidTo>2016-03-29T23:59:59</ValidTo>
				<KeyPeriodNo>1514</KeyPeriodNo>
				<Revoked>false</Revoked>
				<UserDecryptKey>DEADBEEF</UserDecryptKey>
				<UserSigningKeySSK>DEADBEEF</UserSigningKeySSK>
				<UserPubTokenPVT>DEADBEEF</UserPubTokenPVT>
			</KmsKeySet>
			<KmsKeySet Version="1.1.0">
				<KmsUri>kms.example.org</KmsUri>
				<CertUri>cert1.kms.example.org</CertUri>
				<Issuer>www.example.org</Issuer>
				<UserUri>user.psuedonym@example.org</UserUri>
				<UserID>0011223344556677889900AABBCCDDEEFF</UserID>
				<ValidFrom>2015-12-30T00:00:00</ValidFrom>
				<ValidTo>2016-03-29T23:59:59</ValidTo>
				<KeyPeriodNo>1514</KeyPeriodNo>
				<Revoked>false</Revoked>
				<UserDecryptKey>DEADBEEF</UserDecryptKey>
				<UserSigningKeySSK>DEADBEEF</UserSigningKeySSK>
				<UserPubTokenPVT>DEADBEEF</UserPubTokenPVT>
			</KmsKeySet>
		</KmsKeyProv>
	</KmsMessage>
</KmsResponse>
